{
  "schema_version": "1.0.0",
  "registry_id": "registry_genesis_deployments",
  "project": {
    "name": "Genesis",
    "ecosystem": "Synthsara",
    "creator": {
      "name": "Steven Pritchard",
      "role": "Creator and Lead Architect"
    },
    "repository": {
      "host": "github.com",
      "full_name": "chaosweaver007/Genesis",
      "default_branch": "main"
    }
  },
  "registry_metadata": {
    "created_at": "2026-06-22T07:53:33Z",
    "updated_at": "2026-06-22T07:53:33Z",
    "maintainer": "Steven Pritchard",
    "canonicalization": "RFC8785-JCS",
    "registry_sha256": null
  },
  "records": [
    {
      "record_id": "prov_manus_genesis_main_smoke_001",
      "record_type": "deployment",
      "state": "pending_capture",
      "captured_at": "2026-06-22T07:53:33Z",
      "source": {
        "origin_kind": "archive",
        "repository_full_name": "chaosweaver007/Genesis",
        "branch": null,
        "commit_sha": null,
        "tree_sha": null,
        "archive_name": "Genesis-main.zip",
        "archive_sha256": null,
        "source_url": null,
        "dirty_worktree": null
      },
      "environment": {
        "provider": "Manus",
        "executor": "Manus Max AI agent",
        "operating_system": null,
        "architecture": null,
        "python_version": null,
        "dependency_manifest_path": null,
        "dependency_manifest_sha256": null,
        "container_image": null,
        "container_digest": null,
        "environment_capture_path": null,
        "secret_values_recorded": false
      },
      "changes": {
        "parent_record_ids": [],
        "summary": "Agent-reported deployment repair replacing unresolved moment() template calls with a static time label so the Flask templates could render.",
        "files_changed": [
          "Genesis/templates/sarah.html",
          "Genesis/templates/steven.html",
          "Genesis/templates/collective.html"
        ],
        "patch_path": null,
        "patch_sha256": null,
        "uncommitted_changes_present": null
      },
      "build": {
        "status": "partial",
        "started_at": null,
        "completed_at": null,
        "command_manifest_path": null,
        "log_path": null,
        "log_sha256": null,
        "artifact_paths": []
      },
      "deployment": {
        "provider": "Manus",
        "deployment_id": null,
        "url": "https://5000-ig994ng5hjsf7sm8nb3gy-c51607a7.us2.manus.computer",
        "lifecycle": "ephemeral",
        "deployed_at": null,
        "expires_at": null,
        "health_status": "unknown"
      },
      "tests": [
        {
          "test_id": "manus_route_smoke_report",
          "category": "route_smoke",
          "status": "partial",
          "executed_at": null,
          "evidence_path": null,
          "evidence_sha256": null,
          "summary": "Manus reported HTTP 200 responses for 13 routes. Raw requests, timestamps, response bodies, and logs have not yet been exported into the repository."
        },
        {
          "test_id": "manus_chat_smoke_report",
          "category": "chat_smoke",
          "status": "partial",
          "executed_at": null,
          "evidence_path": null,
          "evidence_sha256": null,
          "summary": "Manus reported that Steven AI, Sarah AI, and collective chat paths responded. Test vectors and complete outputs have not yet been captured."
        }
      ],
      "provenance": {
        "created_by": "Steven Pritchard",
        "development_method": "Human-directed collaboration with AI systems",
        "ai_vessels": [
          {
            "name": "Manus",
            "role": "Archive extraction, dependency installation, deployment, smoke testing, and tactical template repair",
            "provider": "Manus",
            "model_or_agent": "Max"
          },
          {
            "name": "Steven AI",
            "role": "Genesis software persona exercised by the deployment",
            "provider": null,
            "model_or_agent": null
          },
          {
            "name": "Sarah AI",
            "role": "Genesis software persona exercised by the deployment",
            "provider": null,
            "model_or_agent": null
          }
        ],
        "captured_by": "OpenAI ChatGPT",
        "reviewed_by": null,
        "evidence": [
          {
            "kind": "deployment_report",
            "location": "User-provided Manus build correspondence in the Genesis remediation conversation",
            "sha256": null
          }
        ]
      },
      "uds_assessment": {
        "status": "not_assessed",
        "principles": {
          "sovereignty": {
            "status": "not_assessed",
            "evidence": [],
            "notes": "Awaiting exported runtime and consent tests."
          },
          "transparency": {
            "status": "conditional",
            "evidence": [
              "Manus reported the tactical moment() repair and route status."
            ],
            "notes": "Raw build logs and diff remain uncaptured."
          },
          "fairness_reciprocity": {
            "status": "not_assessed",
            "evidence": [],
            "notes": "Not evaluated by the smoke report."
          },
          "consent": {
            "status": "not_assessed",
            "evidence": [],
            "notes": "Consent-gate behavior was not included in the report."
          },
          "non_harm": {
            "status": "not_assessed",
            "evidence": [],
            "notes": "Security and inference tests were not included."
          },
          "accountability_auditability": {
            "status": "conditional",
            "evidence": [
              "This pending registry record preserves the reported deployment event."
            ],
            "notes": "The record cannot be verified until the workspace export and logs are captured."
          },
          "accessibility_equity": {
            "status": "not_assessed",
            "evidence": [],
            "notes": "Not evaluated by the smoke report."
          },
          "dignity": {
            "status": "not_assessed",
            "evidence": [],
            "notes": "Not evaluated by the smoke report."
          }
        }
      },
      "verification": {
        "status": "unverified",
        "canonicalization": "RFC8785-JCS",
        "record_sha256": null,
        "signature_type": "none",
        "signature_location": null,
        "verified_at": null,
        "verified_by": null
      },
      "notes": [
        "Do not promote this deployment report to verified status from correspondence alone.",
        "Capture the working archive, exact diff, environment manifest, dependency lock, route-test output, and logs before the Manus workspace expires.",
        "No secret values may be included in registry evidence."
      ]
    }
  ]
}
